no,username,date_review,review_title,review,rating
207,Wraith-,17/2/2022,Is it possible to download resource,"I have a lot resources to download in resources download center but it seems like the download are very slow, while surely i have a good internet connection. So, is there other way to download the resources even i am not opening the app? Or a solution for my slow download speed please? I hope you guys can answer me, thank you",4
208,otteru,16/2/2022,bug,why so many bug in this game?,1
209,BravoIndiaMikeOscar,16/2/2022,Suck,"The new matchmaking system is stupid, i can not longer play with my friends inranked match, the gatcha feels like a scam, you can never win big unless you spend a huge amount of money, i'm quitting soon",1
210,firdho,15/2/2022,MULTI TOUCH ISSUE FOR IPAD,"please fix multi touch issue for ipad, i already reset ipad 2 times, and always get stuck and ghost touch when i push 5 finger together",5
211,Rafael evan m,15/2/2022,BUG,UPDATING DOWNLOAD LIST BUG IS STILL IN THE GAME?? AFTER 2 YEARS,1
212,BhamaAlpha,14/2/2022,Crash in middle of the game,"HEY TENCENT, why do i always crash in the middle of a match in erangel when i play it on iphone 6",1
213,lihgeorih,13/2/2022,Can't download,i can't download the map and another package in the games!,1
214,qiuqiufrr,11/2/2022,fps,please fix 90 fps frame bug in iphone 13 pro max,5
215,CutLiza,10/2/2022,Keep stuck on update page,"its not working, using iphone 12, after update jt keep stuck",1
216,udiennnnn,10/2/2022,"BUG TDM, BUG TRAINING, etc",So many bug in this game,5
217,CONQU BIJAK,9/2/2022,Add,"pubg please add on inventory setting : hide cape/hoodie cause sometimes we want to see our head, add hide backpack and also hide guns",5
218,Kingmaul,9/2/2022,Can't download,NOT DOWNLOAD APP WITH DATA AND WIFI ERROR DON'T TOUCHA NYMORE,3
219,huhhsusah,9/2/2022,too slow,too slow when install this apps,3
220,grizzly213,7/2/2022,FIX IT,"THIS GAME KEEP CRASHING AT THE LOADING SCREEN, I WANT TO PLAY",1
221,Luckhosta Dellens,7/2/2022,Bug,A ton bug in event,1
222,quintoll,6/2/2022,update,stupid update,2
223,Oenoomel,5/2/2022,lag on the iphone 8,lag  ,1
224,nnataakie,5/2/2022,Works,All works on iphone 11 great job tencent,5
225,Bagas triadi sanjaya,5/2/2022,Bug,Bug TDM and bug mission royal pass not complite,1
226,j00ee3,4/2/2022,Down grade,"Many ""BUG"" system after update. After re-call, TDM, and many more bug!! It's gonna be freak update !!!",5
227,Eror download,3/2/2022,downlaod,Pubg i am trying to download it at my ipad 4 but it wont let me download pubg and i have enough storage for download but you wont let me download it please help fix this problem i really want to play,5
228,babyg0407,1/2/2022,the feature is still under beta testing,"i'm a metro royale mode player since the chapter 1, but for this and recent chapter i was kicked from metro royale mode after i report a lot of cheater in metro royale. suddenly i cannot play metro royale and it says ""the features is still under beta testing"" and it happened to my second account too everytime i succesfully reported a cheater. I'm so mad",1
229,hensjsneidns,30/1/2022,Game Revie,Strange. Sometimes the game is really laggy with an excellent internet connection. Most annoying is damge bug. Please fix it!!!,3
230,teler15,27/2/2022,i got banned for unknown problem,Please fix my account problem,1
231,Ari Yosi,25/1/2022,Bad team up,"Why i cannot team up with my friend due to rank issue, while in the game randomly could team up with low rank, please reset this issue so i could",1
232,29 bike shop,24/1/2022,Difference tier,Please delete the difference between player tier its not fair!!!,5
233,No_namePLYR,23/1/2022,Battery drain,it drains battery like vaccum but its still good,5
234,jsjsbzhzj,23/1/2022,Ranked,Bro im a bronze player i want to play ranked with my friend but we cant play because he reach diamond first. Why cant bronze and diamond play together in ranked?,2
235,ceacilicious,21/1/2022,Request time out,always Request time out,1
236,Toyyyadz,20/1/2022,cooldown,Please delete web shooter cooldown at spider-man event,1
237,Ronald Hito,20/1/2022,huh,WE DONT NEED 7 SECOND COOLDOWN WEB STRING!!! Do you want Peter Parker dead?,1
238,giworld20,20/1/2022,Bug from krafton,"After krafton take control, everything seems stupid, mic all bug, bug voice, bug everywhere, RIP PUBGM",1
239,sseoxo,19/1/2022,thank you,"Thanks PUBG Mobile, I found my lover. But now he's ,y ex",2
240,zeinridya,19/1/2022,Complain,Cooldown is too long in event spidey,1
241,Adit Dhita,19/1/2022,Loot crate m416 the fool,"why is the fool's m416 loot crate so small, I spent a lot of money on gacha, to get quality, but why change features like this?",1
242,luthfiaf,19/1/2022,bad,fix bug stupid,1
243,yuhuvkdkdmn,18/1/2022,Too much effect,"Please remove those stupid effect, when you die, you want to play again a.s.a.p but those effect very took lot of time! Damn it stupid.",1
244,cuarzru,18/1/2022,The good of all battle royale game,This game is sick man with the super duper realistic graphic and new super cool map its better then every battle royal game,5
245,awsemcal,18/1/2022,WWCD,iphone 5SE still worked,5
246,nmbhfaqefd,17/1/2022,IPHONE XR BUG FRAME,Crazy bug,5
247,Berita Hutan,17/1/2022,Works,"Finally work on Nokia 3315 Pro, good job vincent",5
248,WARFOZ,15/1/2022,Poor graphics on ipad gen 9,Graphics is not as sharp on ipad gen 8,1
249,PlainZero8,15/1/2022,Stuck at updating download list,Cannot play after updated to vewest version. It stuck at updating doanload list,1
250,Overgreed,15/1/2022,90fps,"My phone is iphone 13 promax, but when i play with 90fps its so laggy!!! Pleas fix it, its so disturb my gameplay5",5
251,Arbellino,14/1/2022,Update,Why is there no update here,2
252,VETERAN PUBGM,14/1/2022,Crash,Plish fix microphone and parachute bugs,2
253,muhammadrafli,14/1/2022,Late,Late update,2
254,azsssssssssh,13/1/2022,Update soon,Please update soon,4
255,reeevita,13/1/2022,Miror,Bring back miror world,4
256,oBtiioio,11/1/2022,game broken alway bug mic never fixed,game broken alway bug mic never fixed,5
257,kazee9999,11/1/2022,BUG REPORT,"PLEASE FIX BUG, always bug when get out from car",2
258,murid entruv,11/1/2022,a little advice for players to feel at home,give playing experience like game for peace,5
259,terserah Lu !,9/1/2022,On may way ,i'm just miss my friend. Thanks for the moment ,5
260,Reii099788,8/1/2022,Bug everywhere  ,"Spectate teammates is always bug, what the ...",1
261,TanLC123,8/1/2022,My iphone 11 is crash you can fixed the crash,Very bad,1
262,skytj,7/1/2022,About pubg,I like it!,5
263,Vinovondraaaaaaaa,6/1/2022,bugs,TOO MANY BUGS PLEASEEEE THE UPDATE IS SO USELESS,2
264,Capinz,3/1/2022,Cheat everywhere,"A big game with famous company like PUBG still can't manage to stop cheating, it's really disappointing when you play and always meet a lot of cheaters in the game. Why such a simple thing still can't be fix in a long time? Please hire some professiona;s a lot more and upgrade the system so not easy to break by cheater! Don't just focus on money and money and money please!!",1
265,danielpradisca,3/1/2022,Dear tencent,Some of the common violation detected by system,1
266,bunsabun,3/1/2022,ipad 6 2018,Fix the force close please. It happens many time. Thank you,5
267,yaddih,2/1/2022,Good game,"Well played, enemy missing",5
268,El'vano,24/12/2021,Update,Why so long to update??,1
269,Miror Zero,23/12/2021,VERY NICE but..,Always bug and make me to soon always,1
270,sourdiugh,22/12/2021,Too many bugs,Fix it.. dont just keep selling clothes,1
271,Saqif Harzam,21/12/2021,Developers suck and dont care about the game,The developers dont care about the game all they want is money i mean like compare it to pubg new state do you know what the difference is? The difference is that one cares about the game the other one doesnt. Youre better off playing new state its got better graphics and the developers actually listen to reviews and critics,1
272,Urangsamarinda,21/12/2021,Please add using controller ps4,Please add a controller,5
273,LAVENDRE36,20/12/2021,Crash,There are multiple crashes reported in my device today and the settings layout is resetted into a different layout,1
274,Aura Ghalliyah,20/12/2021,alula,this work fine on my 12 pro max,5
275,dolphine.exe,19/12/2021,sad,M416 is too overpowered please fix it,1
276,debadebo,19/12/2021,I can't find jinx voice pack that i've unlock,"Quick question, in cycle memories i have unlock jinx voice pack, what do i do to use it? I've seen some one used jinx voice pack, how can i get it?",4
277,teguh culik,15/12/2021,Server bug,"Jump in livik area. I am landing in rooftop, and then lag/delay a moment. After game back to working, at the ground not in rooftop.",3
278,mamankkkk,15/12/2021,frame drop ,frame drop in iphone xr,1
279,Keplerians Fans,11/12/2021,PUBGM,I like this! because PUBG collab with Arcane Lol! (PUBG MOBILE X ARCANE LoL),5
280,Brizky,10/12/2021,Why  ,I use like 3000 uc to gacha open crates and can't get anything,1
281,jendralstore283,9/12/2021,Iphone xr fix fire + Crouch,Please fix touch issue problem combination button fire + button crouch on iphone xr,2
282,jangan main ini,8/12/2021,Too much bug and cheater,Game broken  ,2
283,zidan2403,5/12/2021,bug,"force close in xr and bug loading, crash game please fix it",1
284,budi_s27,4/12/2021,Cannot enter,Why i cannot enter the main lobby. Im stuck with continous update? Never ending update.. restart and update again and again,3
285,TheoAnggara,4/12/2021,Slow,"I have 30Mbps internet connection but i nevet loaded, resource's downloading very slow",1
286,KENZIEWWWWWWWWEWWWEE,3/12/2021,thank you,thank you pubg for 3 years and now i want to say good bye,5
287,Peoskwphsj,3/12/2021,Please add 90fps on iphone 12 pro max too,"Its be good when i playing pubg on 13 pro max the graphic can be smooth - 90fps, but add 90fps too on 12 pro max.",5
288,M250400,1/12/2021,Email link failed,"Please fix this issue, i can't link my pubgm account to my email. Thanks",3
289,hanagava,1/12/2021,Cheater,"Too much cheater in this game, too much. Me and 3 of my friens has left and uninstall this game. Good luck on you Tencent. Cheers",1
290,Your Bae666,30/11/2021,Frame drop,please have so many frame drop after playing 2 matches at iPad 6 gen,1
291,Ju1only,25/11/2021,Skin,Too much skin,1
292,otonqpurwo,24/11/2021,cheater everywhere,too much cheaters,3
293,BVIPkagome,24/12/2021,My uc is missing,"I don't know why my uc disappeared overnight even though I didn't use it, even though I just filled it up two days ago and last night it was still safe and on the last day when i logged in the UC was gone 100, how did i get scared for top up, please explain and help I want it back!!",1
294,pangeran aji,24/11/2021,stuck download list,when open the app it stuck updating download list please fix it,2
295,ipadmini6,23/11/2021,ipad mini 6,not fullscreen on ipad mini 6,2
296,Bento ni bos,22/11/2021,Thanks tencent,Thanks tencent its still worked on my 4s,5
297,awselbii,20/11/2021,weapon missing when changing in arena deathmatch,"please fix this bug, my weapon keep going missing when changing loadout on arena deathmatch. It keeps going and even wont let me pickup other's weapon",3
298,bayu,20/11/2021,disable auto download (wifi/celluler),"please disable automatic in-game downloads (wifi/celluler data) because my memory is small, everytime i log in i always download, that's not what makes game experience better, because it's getting lag and my iphone has been stuck with the Apple logo because of this. I hope you hear this Tencent",2
299,1236,19/11/2021,Outfit,"why are season 1 - season 3 clothes for sale? it should be a special suit for old players. PUBG is now broken, let's retire from this game",1
300,akagaminoshirayukidesu,19/11/2021,Frame,Can you guys fix the frame rate? i'm playing on Iphone 7. i was set my graphic to smooth ultra and then when i went to fight my screen turning to black and i can't move for 10 seconds,3
301,jessievvan,18/11/2021,auto download,"after new update, the auto download can not be turned off. i must stop the download manually",2
302,Spcxryzza,18/11/2021,Iphone 7 frame,"too much bug and frame, you must play in front of fan so that the phone is not hot, but this iphone was lagging and frame",1
303,Ebidahq,18/11/2021,So laggy,"So lag and low frame rate, im using setting on smooth extreme, device iphone xs",3
304,araisyaw,17/11/2021,best,i love it,5
305,dloiuytfhgf,17/11/2021,IOS 14.5.1 IPHONE 13PRO,"Hello, why the new update its nothing happen? my iphone 13pro dont have 90fps",5
306,pakdeJOKOWI,16/11/2021,Automatic download,How to stop download automatic game after update,4
307,Rif-12,16/11/2021,After update,"To the dearest mr developer, please consider that there are many cheaters after the latest update",1
308,PHOENIX PUBG,16/11/2021,SUBSCRIBE MY CHANNEL PHOENIX PUBG,SUBSCRIBE MY CHANNEL PHOENIX PUBG,5
309,call me vellyn,16/11/2021,What  ,Hi! It's work on iPhone 7+ but why if i die the game crashed? i'm sorry i'm bad english,5
310,Edbert89,16/11/2021,Size becoming a problem,"The game is fun but it the app size is getting bigger and bigger and my device may no longer support it, please find some way to optimize it, such as having the option to",3
311,kau,16/11/2021,Good,This is very good game! But lucky is bad,5
312,wildev22,16/11/2021,Down grade,cannot buy premium crate coupon scrap with silver anymore,1
313,tukiwinz,15/11/2021,Nice,okay,5
314,NurRasyad,13/11/2021,Great,Good game,5
315,12hsdg,12/11/2021,Buggy,This game still need some works,3
316,B4q,8/11/2021,Bug,This song annoys me while playing,3
317,aisamini,7/11/2021,error,"on my xs phone it says updating but its never ending, i've installed it but the problem still exist",1
318,Zmech_TheKing,7/11/2021,PLEASE UP MY CHANCE AT GETTING A BUNDLE IN CRATE PLEASE,"Tencent/Krafton please make my account luckier, i been getting a lot of trash things in crates so plese make me luckier at getting the bundle/skin that i want Thank You.",5
319,TrisnaDHK,7/11/2021,Big request for developer,Please unlock 60fps for iphone 7+,4
320,AldoDam,6/11/2021,Account ban,Banning someone for no reason,1
321,uang halal,5/11/2021,Bad,Please reduce the quality,3
322,yuzu wife,5/11/2021,fuck you,i hate this game so much,1
323,Mamiyake,5/11/2021,nice game,nice game,5
324,hauhahahahajqjqjqj,4/11/2021,Bug damage,Low sensitivity gyroscope around 200-250 feels like no damage,1
325,frnmgo,3/11/2021,please add feature unlink and email link,please add feature that can unlink email link im so dissapointed because that,2
326,Kriewol,3/11/2021,Bug,Bug voice on ios/ipados 15 up,3
327,uur player since season 2,3/11/2021,FIX THOSE FUCKIN BUGS,"WHY THE FUCK YOU NEVER CARE ABOUT THE BUGS ON YOUR GAME, ME AND MY FRIEND GOT TOO SOON BECAUSE OF THAT FUCKIN BUGS",1
328,Willy Arvino,3/11/2021,Bug mic,"Hey tencent, please fix your bug mic, almost 3 years i played pubgm and this problem never solved and always have a same problem, bug mic and relog game. please i hope you guys fix this bug ASAP. This bug so damn annoying!",5
329,im fuit,28/10/2021,To Krafton who's developer at this game,"Why i always find bug when i play the game. as if i use scope 6x i can't zoom out like scope x3. And if restart the game when it's happen and you know what bro?? I can't see my team like i playing by yourself and i can't shoot enemy. Damn it!! How many times must i reported to team service but there's no response. It makes me feel worst play this game. And it's not just happen only to me. Though ever since the pubg was on tencent our reports the players got in on it. Not like now who only want money, but not customers satisfaction. If this happened over and over again, maybe people would think twice about playing this game or not playing it at all. May my review be read and understood by all of you.",1
330,Kumalai,26/10/2021,Bug,"Too much bug, too much loading even my signal was stable",1
331,rimuru tempesttt,26/10/2021,frame drop and lag and bug,fixed crash in 6s+ ios 14.7.1 please,1
332,Featuringo,26/10/2021,Can't run in ipad after newest update,Keep saying restart to see new content,1
333,cocaliquid,25/11/2021,Please bring always zombie dawn forever,"sir im playing pubg mobile since season 3 and i love your game till right now, still playin' i mean. (Please ""always bring the zombie mode always available because i love this mode"" Thanl you..",5
334,Naugi45,24/10/2021,Boring game,I done for this game...,1
335,brbrbrding,20/10/2021,Heating and frame rate drop issue,"Hey developer, please fix your game, in 15 minutes classic mode my device (w/bionic A12) heating easily and frame rate is drop (something freeze). So disappointing, horrible experience",1
336,pubg aswww,17/10/2021,pubg network,my pubg always error network when there rain,5
337,Tessa amelia,16/10/2021,Can't download ,Not working on iPhone 6,2
338,aeolian17,16/10/2021,How to get a full screen sizez to iPad mini 6,"It's good if use on my iPhone, but if i playing with my iPad, the screen not full, how to fix it",3
339,acut,16/10/2021,Bad game,game many hackers,1
340,margarethameiggyta,16/10/2021,Nice,Nice,5
341,Handrik Yes,14/10/2021,Log in no response,Log in PUBGM iOS iPhone 12 pro max twitter no response,1
342,Bogi666,14/10/2021,Too many bug ,Stupid game! Too many bug every update,1
343,leander jethro,14/10/2021,My account was stolen,i got ban for 10 year because i reach to conqueror and i have spend around 1200 dolar this is the id 5157661685,1
344,PhantomScarlete,8/10/2021,Cannot use microphone in game with airpods,My phone is in ios 15.1 used airpods gen 2 and weird headset there both can't use microphones. Then i tried to play other games with microphone and they worked so normal. If it bugs or problem from pubgm please fix it!!! i wanna push my rank bro!!,4
345,muh ririin suyanto,7/10/2021,GLACIER,"Halo tencent, can you give me glacieer max?",5
346,jchdhkehxjv,5/10/2021,Can't change profile description,So i have an issue where i cannot change my description before the update i do not have this kind of issue please fix it immediately,3
347,SweetesMan,2/10/2021,Broken game,Broken game,1
348,no weapon its a run simulator,1/10/2021,Need weapon,Please add weapon bad game,1
349,28181,30/9/2021,Unbanned my account,"Pubg broke my account has banned, i'm not ise program ilegal anything",5
350,merdinesta,27/9/2021,Please fix,Please fixed i am always trapped and stuck at miramar maps especially at apartment building. please im always stuck at the building please fixed properly and immediately,5
351,Mochammad Fathan,27/9/2021,UC GLITCHED,"I was playing lucky spin for once (10UC for first roll) but WHY it costs me 130UC instead and got only 1 prize?! Are you really trying to make profit this way? You're on a tip of an iceberg, watch out. RETURN MY MONEY",1
352,iwxcensor,26/10/2021,Too heavy,This game is too heavy to play. Old device isn't frienly for thia game. Play this game with an ipad 6 i got freeze in game. What a shame,1
353,gamegamean,25/9/2021,BAD,BUG BUG and BUG,1
354,Hypstermaid,24/9/2021,uninstall,"after update, this game feels like trash, always loading in lobby, i'll give 1 star for this update",1
355,baguskus,23/9/2021,Crash,"This game is crash often recently.. and the system often told that i idle for too long, and put me back to the lobby",3
356,I0 n,23/9/2021,Lost mode,Where is survive till dawn?,2
357,Babi tencent,23/9/2021,Bug,Fix force close to ip 6s,1
358,Tyrants Lesmana,23/9/2021,Request,"Is it possible at you allow the use of symbols for names again? Otherwise, good game",4
359,Yaora Putra,22/9/2021,WEAPON  ,Please MK14 modification,5
360,ECxCobraBaeEPC,22/9/2021,Help me,"I'm having issue with the server, I'm switching Middle East servers and I'm really clueless with this new rule. I ask Tencent to help bring my game server back to Asia, because the experience of playing on the middle east server is very bad",1
361,Dewkan,21/9/2021,Stuck on login page,The app stuck on the login page,1
362,dewa made rony adanyana,20/9/2021,WHAT ARE YOU DOING GUYS?,"WHEN PUBG WITH KRAFTON COMPANY, THIS GAME IS HIGH BUGGING (TRASH), YOU SHOULD FIX THIS APP BRO, DON'T CHILLIN' at YOUR OFFICE, WORK WORK WORK",1
363,ayen.crow,19/9/2021,Download slow,5days not clear for updates,5
364,adityakevin.96,18/9/2021,I HATE THIS GAME,"SO MANY FUCKIN GLITCH, FIX IT!",1
365,MumuyMartutus,18/9/2021,Long time to update,"It takes long time to update the game, my internet connection is ok",3
366,1.01737E+11,18/9/2021,DOWNLOAD FOR IOS LATE,DOWNLOAD OR UPDATE IN IPHONE SO LATE,1
367,FirmanWilliam,18/9/2021,Hardcore Mode,"Please, Hardcore Mode, like PUBG PC",5
368,Soel34,17/9/2021,Vikendi,Where vikendi????,3
369,player030781,17/9/2021,very cool game huh,I pretty like it,5
370,mini5pro,17/9/2021,Bug,iPad mini 5 sound game missing,2
371,Haiiishka,17/9/2021,storage,take up too much storage in my phone,2
372,windshehsdhdhb,17/9/2021,Great game,Its a great game especially the recent update that adds Nacore coins although my when its updating i do not encounter any problems my friend take en entire day to update please tell me why,5
373,9HccU,17/9/2021,METRO ROYALE,Thanks for adding back metro,5
374,badgerljik,16/9/2021,Brnom,Why took so long just for updating? Just stuck,1
375,hannarch,16/9/2021,can't update,"i can't update on my device, i don't know why. I already use the wifi and also try to update with my cellular data, but it didn't work",1
376,rules besttttt,16/9/2021,Metrooo,Metro royale is back!!,5
377,mr.stars,16/9/2021,Crash,Can't update,1
378,tadunk,16/9/2021,PUBG MOBILE,nice game,5
379,Magdalollyna,16/9/2021,You say payload coming back at update 1.6,"When payload coming back! You say it coming at update 1.6, Sooo NOTHING.. ALREADY UNINSTALL THIS GAME",1
380,Flamehelix,16/9/2021,Download so slow on recent updates,"Why are the updates so slow on app store ffs? Even if i am leaving it for 1 day, the update are never done download",5
381,SENSEN WARGANA,16/9/2021,Bug voice mic teammates,"Too much bug, you know! Always bug everytime everyday every single match. Fix it! Always BIG UPDATE AND NEVER SETTLE THIS BUG. LOL",1
382,MY_A,16/9/2021,Custom,Please add some military custom PLEASE!,4
383,cfh__,16/9/2021,MILITARY SKIN CRATE,add military skin crate please!,4
384,kerrors,15/9/2021,Error,Keep telling me that i need update in game feature.. its the 10th times,1
385,divaratnasita,15/9/2021,Best,Best game ever thanks for accompany me when im sick because of covid 19 love pubgm,5
386,tiktok wibu,15/9/2021,FIX THE BUG! WHAT THE..,I PLAY AND GET DISCONNECTED? WHAT DO YOU MEAN?,5
387,mesetiol,15/9/2021,Slowly,"Every single time when i try to update this app, always need much time to start download, i dont know my internet its okay, my storage is okay not full i dont know",3
388,jembot asu,15/9/2021,Bug in IPHONE XR,Force close again,1
389,Nanda Gaming,15/9/2021,We need M416 upgradeable skin,Please bring M416 upgradeable skin Thank you!5,
390,chiwa9876,15/9/2021,Vikendi,Please bring back Vikendi in classic,5
391,gudeatama,15/9/2021,can't update,"i clicked update but its not updating, only waiting and not even the update loading. please help!!",4
392,sdesisisi,15/9/2021,YEAY,"Finally, many mode and its now more fun, I use to be bored and rarely played it but now, because everything's here especially metro royale, this is way more fun, just i'm afraid that there is still hackers and too much glitch but Now, I LIKE IT thanks",5
393,Niko,15/9/2021,Downloading ,It is nearly impossible to update the game in my iphoen on wifi. Whenever this is an update i have to delete my game and reinstall it. Which is also taking the one whole day,1
394,farbrutal,15/9/2021,Crash,Lol,1
395,Johnson Fransiscus,15/9/2021,Gabe,Please fix the update is very slow and i jve trued delete every aplication,1
396,Ilham Diemust,15/9/2021,Smooth,That very beautiful on XR,5
397,game kimak,15/9/2021,sad,Bug,1
398,ihuygvyv,14/9/2021,Best game ever,"It's more than a game, unknown people meet everyday and become family",5
399,aangdhona,14/9/2021,Boring map,Please bring back Vikendi,2
400,rricko,14/9/2021,Update,Update low,1
401,NESKATSFE,14/9/2021,UPDATE LOW PROGRESS,"UPDATE LOW PROGRESS, FREAK!",3
402,blackhunter87,14/9/2021,Error,The gyroscope is doesn't working,2
403,1234000000,14/9/2021,System server bad,"System server bad (frame, lag)",5
404,Zubin Cortez,14/9/2021,Love the new update!,I really love this new update! It runs much much much smoother and feels cleaner. I olove the change of the effects too. The game feels different now and i'm still using the same old graphic setting which is smooth extreme on iPad mini 5 in asia server. But it really feels like playing on pc. It's just amazing. Thanks PUBG!,5
405,ps,14/9/2021,Crouch issue,"I can't seem to crouch and shoot at the same time, i have to wait a few second",2
406,wildansyarif,14/9/2021,Hardcore mode,Please hardcore mode,5
407,sniustad,14/9/2021,Please add vikendi,please,4
408,PREMANGARCADE,14/9/2021,good tencent you give me trash item,good you give me trash item,5
409,cheat dimana dimana,14/9/2021,Trash game,I don't like this game,1
410,Devaa,13/9/2021,Please fix bug,"Iphone xs max bug one shoot, bug crosshair",2
411,vincent tanu jaya,10/9/2021,Ace master please,Ace master please,5
412,Dr.Sagne,8/9/2021,Bug multi touch,"Please fix it, multi touch issue on device iphone xs max",1
413,fizul hasan,6/9/2021,iPhone 6s lag,I think it should be optimized for lower iPhone as a low device they give us lower fps instead there are a lot of lag frame drops also there is some gyro delays hope so tencent will fix this in 1.6 update,1
414,dvvid,4/9/2021,AUTHENTICATION FAILED,Please fix the error! My ID can't login and the reason authenticating failed. please fix it ASAP,1
