no,username,date_review,review_title,review,rating
415,jojoferrel,1/9/2021,crash,"im geting crash sometimes, i mean my phone is restart by itself or crash. can you tell me to fix it? please",1
416,Mayxel Gabrielo,31/8/2021,stuck,why stuck download on iphone 7,3
417,wow1111112222,31/8/2021,Nice,nice game,5
418,xv2Dx,29/8/2021,Dissapointed feeling after 1 year playing,too much cheater and cheating people using bug,1
419,marcherline sik,29/8/2021,PUBG MOBILE,i play from season 3 and never get a skin from spinning with uc so at least give me glacie please it worth a lot for the uc i spend for spinning and didn't get anything please,3
420,wamshero,27/8/2021,Bug login,"I logged in as usual using my facebook, when i played pubg, my phone was ringing, after i finishing my phone and continued the game, my game bach to first time and i need to create new avatar, please bring back my previous account",4
421,cchiccovc,27/8/2021,Smooth,Enjoy,5
422,CGeveeeeee,26/8/2021,Bug,"Always error, many bug not fixed yet",3
423,vierost88,25/8/2021,Cheater ,"So many cheater, please fix",2
424,MRDSniper,25/8/2021,Good game but needs improvement for fair gameplay,"Since the 1.5 update, i've really enjoyed fair fire rate with different fps, and the spam crouch, and the ipad view, that was really good. However i would like to see ipads beeing allowed in official tournaments again and also i've realised that the movement of after 1.5 update gor slower, and i think i love the old movement speed better. Also a lot of people were also sad about the quick prone technique, i hope that you will bring that back. I've also noticed that when you scope with crouch or spam crouch, it glithces the screen and tends to ruin our aim, hopefully you guys can fix this. Overall in my opinion, 1.5 update is already awesome, but i'm hoping that the 1.6 update will fix this and hopefully bring back same old good features back, and have vikendi back. Thanks PUBGM",4
425,kasih 60fps,24/8/2021,Please iPhone 6 60fps,Please iPhone 6 60fps,1
426,ERFpeace,22/8/2021,BUGS,"Overall the game is incredibly smooth, but there are some major bugs that really annoys me such as the mic not working upon joining a lobby of friends, or once the match",3
427,tan9378,21/8/2021,Good game,Good game,5
428,siragil,21/8/2021,Bad server,"can't log in, server not response",1
429,imfenyr,21/8/2021,More memories,"Best game, meet more friend in here",5
430,alexanderdany,20/8/2021,Can't download ,Can't download in iphone 7,1
431,Reyvino,20/8/2021,This game is so crash,This game is so crash,5
432,yang kau sakiti,19/8/2021,Bug,"So many bug, lag or crash. this game is broken",1
433,Arnold Vero,12/8/2022,I love it,Good but please support HD for Iphone 6 if you want more e success,5
434,Dhipra,14/8/2022,too many cheater,"why don't you ban cheater from the IP instead of the account? They can make tousand account! Please be smart, or you guys affraid if don't have cheater player?",1
435,Renaldif,14/8/2022,FACEBOOK LOGIN FAILURE,"UPDATE EDIT, ITS FIXED THANK YOU, before: I cannot login via facebook, it said, my account has logged in newer version, please update to the newest version, BUT IT ALREADY THE NEWEST VERSION.. IPAD USER HERE.. LIKE MY COMMENT SO PUBG WIL NOTICE",5
436,blxckpearl,15/8/2022,token game,too many cheater. Always prioritizing update skins. Bug every new updates. FIX YOUR FREAKING GAME TNCENT FFS.,1
437,mantapjaya,14/8/2022,login bugs,"Please fix this bug, i can't login that say i need newest pubg app for ios, please fix it asap, i have topup much money there but can't logged in",1
438,uju santui,14/8/2022,broken,"pubg i feel a bug, when shifting the scope like broken broken and jiggling, on the iphone xs max cellphone",1
439,ohhellooo,14/8/2022,Not newer version!,Can't login. It says i have the older version after i updated the app.,1
440,Adisas17,14/8/2022,login eror,already update to this new 0.18.0 but when try to login its say account has been login to the new version? I already installed the newest verion? are you kidding me?,1
441,putu pendit,13/8/2022,Offline mode,Please make in offline mode please...even we need pay its okay...because I'm Seaman.thanks,5
442,aldo_rmn,14/8/2022,Please !,"PUBG, I love this game so much, but still much hacker in playing match, but can you tighten security?? And can you try playin on the server INDIA (pushing rank) conqueror!! A lot of hacker everywhere with statistic so high. they are play cheat while those of us don't use cheat feel UNFAIR, we need a hacker destroyed",4
443,sh*t gamers,13/8/2022,Bad graphic and bad frame rate,Bad Graphic and bad frame rate on my ipad 6. I can't to choose frame rate extreme mode and graphic HDR. This is very disturbing to my gameplay. Please fix it !!! Thank you..,1
444,IMWQE,14/6/2022,Server Problem,"Please fix the Asia server, cause i can't play if the server response still broken. Please fix it.",5
445,Big black bick,15/8/2022,Connection error,"now and then PUBGM has some internet error, like frame drops, lag, etc. Usually PUBG doesn't do this but now it does, and its not just me who has experienced this type of problem. Other than that its fun game and I am inerested to see more of PUBGM's events and updates",4
446,Mincrft fan ..,15/8/2022,tencent,"hello developer i just want pubg mobile add new map taego and paramo, and new weapon K2 and new vehicle ''pony caupe''. please add it, i just want pubg just look ike in pubg pc",5
447,izhnu,15/8/2022,iphone 6,"so lagging on iphone 6 so sad, admin please fixed",4
448,rafly_zs,15/8/2022,Iphone 12 Series Bug,"the big update is awesome, but fix the bug that occured on iphone 12 series. The screen ratio turns to be smaller afer conducting an update. Thank you",2
449,Alazzhr,15/8/2022,Dissapointed,"I appreciate for the developers to build this game. Shut out to Tencent. But, till now, on Iphone especially IOS 14.4 there are so many bugs that makes inconvenience to play this game. Im so sorry to say that. Start from the audio bug, graphics, and so many cheater there. I hope for thr developer can fix immediately. Thanks.",1
450,yeezusfbf,15/8/2022,sound,sound of game and teammates disappear all the time,1
451,vissionn,15/8/2022,bugs and fixes,Why sound and mic bug always happened after we relogging inside the match? Broken game.,1
452,umarbobenk,15/8/2022,Complainment,can't change server until 60 days.. so bad updates,1
453,Kanggoman,15/8/2022,Lag,lagging connection. Poor game,1
454,Modennaa ,15/8/2022,Bug,Please fix the bug that anti aliasing could not be activated iphone 7 Plus,4
455,bantalbobo,15/8/2022,Anti aliasing can't active,"Bad service from pubgm, this season 17 update. Its took about one week and there is no solution. bad service and i think pubgm don't care about player who make this game populer. Very dissapointed. PUBG MOBILE DONT CARE ABOUT PLAYER!!!",1
456,sebastian pramana,15/8/2022,Antiliasing,Wy antiliasing not working tencent??,5
457,gloryjokian,15/8/2022,Bad performace,Frame drop issue on IOS 14.3 using iphone x,3
458,123rahmatu,15/8/2022,Dear developer,"I can't activate the anti-aliasing system in the graphics settings, this happened after i did a update, please fix it soon",3
459,minato0412,15/8/2022,i lost my account,"i lost my pubg account, when i want to play pubg after 4 months not playing my pubg account was dissapeared, i linked my pubg account with facebook, please moonton give back my account, i play pubg since season 4 and i already buy royal pass like 6 times",1
460,athlfrldndr,15/8/2022,Server Problem,i play pubg mobile from season 2 to season 16 and when change my server i need to wit for 60 days what a waste of time!,1
461,Tamkabox,15/8/2022,Help me,"tencent ,, please return my server to Asia",1
462,MichaelShi399,15/8/2022,PLEASE FIX THE CHEAT,please fix the cheat,5
463,y3re,15/8/2022,cheater too much,bad games cause cheater everywhere and tencent just silent,1
464,wizo060,15/8/2022,Make this game clear please,"Dear Tencent, you need to act more seriously about player who cheat all around this my lovely game, mostly all match i make meet cheat, i use full gear level 3 and full durability, and i knocked by 2 bullets with m416, its even don't make any sense. Please make sure you clear this game off cheating players, or your game die and no one play anymore",3
465,Cinx86,15/8/2022,Too much chater !!!,I meet cheater player in every single matchs i have played. Please fix it !!!!,1
466,raflipindoy,15/8/2022,Banned cheater,"For Tencent, we hope that the cheat is banned as soon as possible, thank you, from indonesia",5
467,Ericpramudya,15/8/2022,.,too many cheater and my ip7 is so potato,2
468,Hansen Nyohardi,15/8/22,Didn't break any rules and got banned,I didn't break any rules of pubg and i just play it normally why pubg is banned my account ?,1
469,mintz02,15/8/2022,.,after update on iphone 7 always crash while playing,1
470,arjir10,14/8/2022,Pubg,why i cant update it??,5
471,Mskeleton,14/8/2022,About update 2.0,Bro don't make it look like that just add guns the graphic is so much lower and th buildings are so weird please change them back like now and just add like a snow storm of new gun or d a new mode the graphic in 2.0 is so trash man please change it for the last time,5
472,Daffnaufal,14/8/2022,cannot open since 13.5 update,i cannot open the game after updating to ipad ios 13.5 on my ipad pro.,1
473,mrulol,14/8/2022,bug ios,rip ios bug login,1
474,dimasyogi,14/8/2022,bug login,game broken!!!!fck fck tencent,1
475,Amar Alkaff,14/8/2022,I cant login,please fix this bug login,1
476,Dhiki S,14/8/2022,notched phone type,there is bug in enemies a head on notched phone,1
477,qpjndhsha,14/8/2022,cant play,PLEASE FIX BUG LOGIN FACEBOOK I CANT PLAY 5day !!!!! SERIOUSLY TENCENT?!!!!!,1
478,Nawaw,14/8/2022,Unlink account,"Dear Tencent, many player include me cannot login with facebook or social media account. With reason not new version. Please fix the error!!!",1
479,damninsta_,14/8/2022,BUG,There's stil so many bug! please fix it. app keep crashing while open friendlist.,1
480,sohib23 motovlog,14/8/2022,Lost account after update,"My account was gone, I can't sign in into my old account, please fix it",1
481,SAVABurz,14/8/2022,Bug,New version bug in IOS cant login,5
482,minipubgm,14/8/2022,Laggy after update 0.18,"I'm use ipad mini 5, laggy after last update 0.18",2
483,PapaBozzz,14/8/2022,CANT LOGIN,"After update, IOS CANT LOGIN",1
484,bebyfarsya,14/8/2022,Fix the bug please,Can't login on ios.,2
485,Rerearmadian,14/8/2022,Gyro bug,"Please fix bug on scope on with gyro, its become choppy",1
486,SatriaBuana,14/8/2022,Fix it,Fix the bug. Cant login on ios,1
487,sisizkala,14/8/2022,Newer version BAD,"I've updated to the newer version but it still say mine is older version it's wont logging, please fix it.",1
488,Imam arief,14/8/2022,login bugs,In this new version facing with bug login. Keep getting error Account has been logged in with a newer version of the game and can no longer log in with an older version even there is no update both in app store and inside the game,3
489,kang geboy,21/8/2021,Bug ghost touch,why on my iPhone xr there are ghost touch,1
490,athallahyt,23/8/2021,No,"I'm tired, i don't want download this game again",1
491,tripataxninja,27/8/2021,Pubg,Good game,5
492,ishika tifanny,27/8/2021,GB,the size always much biger,2
493,Reginaariviana,30/8/2021,Can't play,"Always loading, can't enter the game",2
494,Cahyadi Andres,31/8/2021,Nice,Always good game,5
495,PAK SAKERA,1/9/2021,Please,How to unlink or remove the link email,5
496,IphoneXR,3/9/2021,Download more than 3 hours,"Download is slow, please fix it",2
497,Daffagaming,6/9/2021,Having fun,this game so good,5
498,joenne huang,14/9/2021,crash,"i want to log in after update, but its always force close",3
499,leekehensz,14/9/2021,iPhone xr,"excellent for the graphic, but its fast to get overheat",1
500,aderawan_1,15/9/2021,iOS can't update,can't update this game,2
